{
  "$schema": "https://json-schema.org/draft/2020-12/schema",
  "$id": "https://nauticana.github.io/charter/schema/enterprise/position.schema.json",
  "title": "Position",
  "description": "A stable assignment point in exactly one organization unit, outside the unit tree; occupancy and support are separate Assignments.",
  "x-charter-requirements": [
    "CHR-ENT-001",
    "CHR-ENT-004",
    "CHR-ENT-005",
    "CHR-ENT-009",
    "CHR-CONF-004",
    "CHR-INFO-009"
  ],
  "type": "object",
  "allOf": [
    {
      "$ref": "../common.schema.json#/$defs/documentBase"
    }
  ],
  "properties": {
    "charterSpecVersion": true,
    "namespace": true,
    "id": true,
    "name": true,
    "description": true,
    "lifecycleState": true,
    "validity": true,
    "extensions": true,
    "sourceEvidence": {
      "type": "array",
      "minItems": 1,
      "uniqueItems": true,
      "items": {
        "$ref": "../common.schema.json#/$defs/idRef"
      },
      "x-charter-ref-kinds": [
        "EvidenceRecord"
      ],
      "description": "Evidence the modeled facts rest on; required when they were derived rather than entered by their accountable owner (CHR-INFO-009)."
    },
    "kind": {
      "const": "Position"
    },
    "enterpriseId": {
      "$ref": "../common.schema.json#/$defs/idRef",
      "x-charter-ref-kinds": [
        "Enterprise"
      ]
    },
    "organizationUnitId": {
      "$ref": "../common.schema.json#/$defs/idRef",
      "x-charter-ref-kinds": [
        "OrganizationUnit"
      ]
    },
    "positionTypeId": {
      "$ref": "../common.schema.json#/$defs/idRef",
      "x-charter-ref-kinds": [
        "PositionType"
      ]
    }
  },
  "required": [
    "kind",
    "name",
    "enterpriseId",
    "organizationUnitId"
  ],
  "unevaluatedProperties": false
}
