{
  "charterSpecVersion": "1.3.0",
  "namespace": "harbor.example",
  "kind": "Position",
  "id": "PP-PLN-01",
  "enterpriseId": "ENT-HARBOR",
  "name": "Production Planner",
  "organizationUnitId": "OU-PRODUCTION-PLANNING",
  "lifecycleState": "active",
  "validity": {
    "from": "2024-01-01"
  }
}
